{
  "request_context": {
    "schema_version": "1.0.0",
    "request_id": "req_product_00000003",
    "correlation_id": "corr_product_00000003",
    "trace_id": "trace_product_00000003",
    "requested_at": "2026-08-08T00:52:00Z",
    "actor": {
      "tenant_id": "tenant_yaya",
      "actor_id": "student_0001",
      "actor_type": "student",
      "roles": [
        "game:player"
      ]
    },
    "content_ref": {
      "unit_id": "YAYA_FARM_001",
      "version": "1.4.0",
      "content_hash": "aaaaaaaaaaaaaaaaaaaaaaaaaaaaaaaaaaaaaaaaaaaaaaaaaaaaaaaaaaaaaaaa"
    }
  },
  "session_id": "session_agent_001",
  "draft_id": "draft_water_001",
  "skill_id": "skill_water_001",
  "revision": 7,
  "content_ref": {
    "unit_id": "YAYA_FARM_001",
    "version": "1.4.0",
    "content_hash": "aaaaaaaaaaaaaaaaaaaaaaaaaaaaaaaaaaaaaaaaaaaaaaaaaaaaaaaaaaaaaaaa"
  },
  "display_name": "自动浇水",
  "source_bundle": {
    "language": "CPP20",
    "entrypoint": "src/main.cpp",
    "files": [
      {
        "path": "src/main.cpp",
        "content": "#include <yaya/skill.hpp>\nint main() { return 0; }\n",
        "content_sha256": "5e7b1c8414988b8dbde4e72f3bd9d3db0a01c6c33ef32e69be263156a04b4075"
      }
    ]
  },
  "draft_sha256": "53c203ad61eb09d45d0ca946b2d751cdca5eac9a029baceb8103cb740cc7226c",
  "created_at": "2026-08-08T00:52:00Z",
  "updated_at": "2026-08-08T01:00:00Z",
  "last_applied_patch_id": null,
  "links": {
    "self": "/product-experience/v1/sessions/session_agent_001/skill-drafts/draft_water_001",
    "session_workspace": "/product-experience/v1/sessions/session_agent_001/workspace",
    "builds": "/v1/skill-builds"
  }
}
